{
  "schema_version": "1",
  "key": "smart-diff",
  "name": "Smart Diff",
  "description": "LLM-assisted comparison of two documents. Surfaces matches, conflicts, and missing items with a traceable HTML report attached to the first document.",
  "version": "1.3.2",
  "tags": [
    "documents",
    "llm",
    "icd"
  ],
  "icon": "git-compare",
  "stages": [
    {
      "key": "configure",
      "name": "Select documents and model",
      "description": "Pick the two documents to compare, the credential to use, and the model. The report is attached to the first document.",
      "inputs": [
        {
          "key": "file1",
          "label": "First document",
          "type": "resource",
          "required": true,
          "help": "The report will be attached to this document as an artifact.",
          "filter": {
            "extensions": [
              "pdf",
              "docx",
              "xlsx",
              "txt"
            ]
          }
        },
        {
          "key": "file2",
          "label": "Second document",
          "type": "resource",
          "required": true,
          "filter": {
            "extensions": [
              "pdf",
              "docx",
              "xlsx",
              "txt"
            ]
          }
        },
        {
          "key": "llm_credential",
          "label": "Linked account credential",
          "type": "auth_secret",
          "required": true,
          "help": "Any of your linked accounts. The model list below follows the credential you choose (matched on its name)."
        },
        {
          "key": "model",
          "label": "Model",
          "type": "enum",
          "required": true,
          "help": "Each choice is a Smart Diff function of the @bcapetillo:smart_diff module registered for that provider and model.",
          "filter": {
            "options_by": {
              "source": "$inputs.llm_credential.name",
              "match": "contains",
              "groups": {
                "openai": [
                  {
                    "value": "@bcapetillo:execute_openai_gpt-4o",
                    "label": "OpenAI / GPT-4o"
                  }
                ],
                "anthropic": [
                  {
                    "value": "@bcapetillo:execute_claude_opus-4.8",
                    "label": "Anthropic / Claude Opus 4.8"
                  }
                ],
                "claude": [
                  {
                    "value": "@bcapetillo:execute_claude_opus-4.8",
                    "label": "Anthropic / Claude Opus 4.8"
                  }
                ],
                "gemini": [
                  {
                    "value": "@bcapetillo:execute_gemini_1.5-pro",
                    "label": "Google / Gemini 1.5 Pro"
                  }
                ],
                "google": [
                  {
                    "value": "@bcapetillo:execute_gemini_1.5-pro",
                    "label": "Google / Gemini 1.5 Pro"
                  }
                ]
              }
            }
          }
        },
        {
          "key": "prompt",
          "label": "Focus",
          "type": "text",
          "required": true,
          "default": "Diff these two files",
          "help": "What matters most in this comparison, for example signal timing or voltage tolerances. Passed to the module as the focus prompt.",
          "filter": {
            "multiline": true,
            "max_length": 2000
          }
        }
      ],
      "function": {
        "name": "$inputs.model",
        "version": "1.0.0",
        "target": "file1",
        "tool_name": "LLM",
        "operating_system": "Ubuntu 24.04",
        "parameters": {
          "prompt": "$inputs.prompt"
        },
        "sources": {
          "file2": "$inputs.file2"
        },
        "auth_bindings": {
          "auth_token": "$inputs.llm_credential"
        },
        "tool_version": "1.0"
      },
      "outputs": [
        {
          "key": "artifacts",
          "label": "Diff report (diff_output.html), prompt audit, and job logs",
          "type": "artifact"
        }
      ]
    },
    {
      "key": "results",
      "name": "Results",
      "view": {
        "type": "artifact_list",
        "source": "$stages.configure.outputs.artifacts"
      }
    }
  ]
}
